{
  "schema_version": 1,
  "created_at_utc": "2026-08-23T15:02:11Z",
  "host": {
    "hostname": "benchmark-host",
    "platform": "Linux-6.12.86+deb13-amd64-x86_64-with-glibc2.41",
    "python": "3.13.5"
  },
  "model": {
    "path": "/models/lmstudio-community/Qwen3.6-35B-A3B-GGUF/Qwen3.6-35B-A3B-Q8_0.gguf",
    "size_bytes": 36903139168,
    "sha256_first_last_mib": "fd911f7c571a6035b981732cd8009cb98f55a6e14a967e032858976a9d075649"
  },
  "backend": {
    "llama_bench": "/tmp/vrambridge-llama-build/bin/llama-bench",
    "llama_cpp_commit": "b21e4de74567f5eef213765c9476a843c2e43f0d"
  },
  "parameters": {
    "prompt_tokens": 8192,
    "generation_tokens": 32,
    "repetitions": 3,
    "fit_target_mib": 1024,
    "fit_context": 16384
  },
  "runs": [
    {
      "name": "auto-fit",
      "command": [
        "/tmp/vrambridge-llama-build/bin/llama-bench",
        "-m",
        "/models/lmstudio-community/Qwen3.6-35B-A3B-GGUF/Qwen3.6-35B-A3B-Q8_0.gguf",
        "-p",
        "8192",
        "-n",
        "32",
        "-r",
        "3",
        "-o",
        "json",
        "-fitt",
        "1024",
        "-fitc",
        "16384",
        "-c",
        "16384",
        "-ctk",
        "q8_0",
        "-ctv",
        "q8_0"
      ],
      "command_shell": "/tmp/vrambridge-llama-build/bin/llama-bench -m /models/lmstudio-community/Qwen3.6-35B-A3B-GGUF/Qwen3.6-35B-A3B-Q8_0.gguf -p 8192 -n 32 -r 3 -o json -fitt 1024 -fitc 16384 -c 16384 -ctk q8_0 -ctv q8_0",
      "environment": {},
      "status": "failed",
      "started_at_utc": "2026-08-23T15:02:11Z",
      "duration_seconds": 1.065493384000547,
      "estimated_load_and_warmup_seconds": null,
      "return_code": 1,
      "measurements": null,
      "telemetry": {
        "process": {
          "summary": {
            "sample_count": 1,
            "peak_process_rss_bytes": 217088,
            "minimum_system_ram_available_bytes": 117269336064,
            "whole_process": {
              "sample_count": 1,
              "duration_seconds": 0.0,
              "peak_process_rss_bytes": 217088,
              "minimum_system_ram_available_bytes": 117269336064,
              "process_cpu_seconds": 0.0,
              "average_process_cpu_percent": null
            }
          },
          "samples": [
            {
              "elapsed_seconds": 0.0005340670004443382,
              "process_rss_bytes": 217088,
              "process_cpu_seconds": 0.0,
              "system_ram_available_bytes": 117269336064
            }
          ]
        },
        "gpu": {
          "units": {
            "pwr": "W",
            "gtemp": "C",
            "sm": "percent",
            "mem": "percent",
            "fb": "MiB",
            "bar1": "MiB",
            "rxpci": "MiB/s",
            "txpci": "MiB/s"
          },
          "summary": {
            "sample_count": 1,
            "pwr": {
              "mean": 40.0,
              "max": 40
            },
            "gtemp": {
              "mean": 42.0,
              "max": 42
            },
            "sm": {
              "mean": 7.0,
              "max": 7
            },
            "mem": {
              "mean": 4.0,
              "max": 4
            },
            "fb": {
              "mean": 1006.0,
              "max": 1006
            },
            "bar1": {
              "mean": 45.0,
              "max": 45
            },
            "rxpci": {
              "mean": 42.0,
              "max": 42
            },
            "txpci": {
              "mean": 186.0,
              "max": 186
            }
          },
          "samples": [
            {
              "Date": 20260823,
              "Time": "10:02:11",
              "gpu": 0,
              "pwr": 40,
              "gtemp": 42,
              "mtemp": null,
              "sm": 7,
              "mem": 4,
              "enc": 0,
              "dec": 0,
              "jpg": 0,
              "ofa": 0,
              "fb": 1006,
              "bar1": 45,
              "ccpm": 0,
              "rxpci": 42,
              "txpci": 186
            }
          ],
          "stderr": ""
        }
      },
      "parse_error": "llama-bench stdout was not valid JSON: Expecting value: line 1 column 1 (char 0)",
      "stdout": "usage: /tmp/vrambridge-llama-build/bin/llama-bench [options]\n\noptions:\n  -h, --help\n  --numa <distribute|isolate|numactl>         numa mode (default: disabled)\n  -r, --repetitions <n>                       number of times to repeat each test (default: 5)\n  --prio <-1|0|1|2|3>                         process/thread priority (default: 0)\n  --delay <0...N> (seconds)                   delay between each test (default: 0)\n  -o, --output <csv|json|jsonl|md|sql>        output format printed to stdout (default: md)\n  -oe, --output-err <csv|json|jsonl|md|sql>   output format printed to stderr (default: none)\n  --list-devices                              list available devices and exit\n  -v, --verbose                               verbose output\n  --progress                                  print test progress indicators\n  --no-warmup                                 skip warmup runs before benchmarking\n  -fitt, --fit-target <MiB>                   fit model to device memory with this margin per device in MiB (default: off)\n  -fitc, --fit-ctx <n>                        minimum ctx size for --fit-target (default: 4096)\n\ntest parameters:\n  -m, --model <filename>                            (default: models/7B/ggml-model-q4_0.gguf)\n  -hf, -hfr, --hf-repo <user>/<model>[:quant]       Hugging Face model repository; quant is optional, case-insensitive\n                                                    default to Q4_K_M, or falls back to the first file in the repo if Q4_K_M doesn't exist.\n                                                    example: ggml-org/GLM-4.7-Flash-GGUF:Q4_K_M\n                                                    (default: unused)\n  -hff, --hf-file <file>                            Hugging Face model file. If specified, it will override the quant in --hf-repo\n                                                    (default: unused)\n  -hft, --hf-token <token>                          Hugging Face access token\n                                                    (default: value from HF_TOKEN environment variable)\n  --offline                                         Offline mode: forces use of cache, prevents network access\n                                                    (default: disabled)\n  -p, --n-prompt <n>                                (default: 512)\n  -n, --n-gen <n>                                   (default: 128)\n  -pg <pp,tg>                                       (default: )\n  -d, --n-depth <n>                                 (default: 0)\n  -b, --batch-size <n>                              (default: 2048)\n  -ub, --ubatch-size <n>                            (default: 512)\n  -ctk, --cache-type-k <t>                          (default: f16)\n  -ctv, --cache-type-v <t>                          (default: f16)\n  -t, --threads <n>                                 (default: 16)\n  -C, --cpu-mask <hex,hex>                          (default: 0x0)\n  --cpu-strict <0|1>                                (default: 0)\n  --poll <0...100>                                  (default: 50)\n  -ngl, --n-gpu-layers <n>                          (default: -1)\n  -ncmoe, --n-cpu-moe <n>                           (default: 0)\n  -sm, --split-mode <none|layer|row|tensor>         (default: layer)\n  -mg, --main-gpu <i>                               (default: 0)\n  -nkvo, --no-kv-offload <0|1>                      (default: 0)\n  -fa, --flash-attn <on|off|auto>                   (default: auto)\n  -dev, --device <dev0/dev1/...>                    (default: auto)\n  -lm, --load-mode <auto|none|mmap|mlock|mmap+mlock|dio> (default: auto)\n  -mmp, --mmap <0|1>                                (DEPRECATED IN FAVOUR OF --load-mode)\n  -dio, --direct-io <0|1>                           (DEPRECATED IN FAVOUR OF --load-mode)\n  -embd, --embeddings <0|1>                         (default: 0)\n  -ts, --tensor-split <ts0/ts1/..>                  (default: 0)\n  -ot --override-tensor <tensor name pattern>=<buffer type>;...\n                                                    (default: disabled)\n  -nopo, --no-op-offload <0|1>                      (default: 0)\n  --no-host <0|1>                                   (default: 0)\n\nMultiple values can be given for each parameter by separating them with ','\nor by specifying the parameter multiple times. Ranges can be given as\n'first-last' or 'first-last+step' or 'first-last*mult'.\n",
      "stderr": "ggml_cuda_init: found 1 CUDA devices (Total VRAM: 15819 MiB):\n  Device 0: NVIDIA GeForce RTX 5070 Ti, compute capability 12.0, VMM: yes, VRAM: 15819 MiB\nerror: invalid parameter for argument: -c\n"
    }
  ]
}
